{
  "id": "req-5d8926524c36",
  "type": "new_theme",
  "status": "pending_review",
  "title": "Add Ocean theme",
  "currentVersionId": "v1",
  "versions": [
    {
      "id": "v1",
      "createdAt": "2026-06-11T11:33:02.670Z",
      "authorAgent": "cursor-agent",
      "rationale": "A calming blue/teal palette derived from Modern.",
      "payload": {
        "kind": "theme",
        "theme": {
          "id": "ocean",
          "name": "Ocean",
          "description": "Cool blues and teals inspired by the sea.",
          "colors": {
            "light": {
              "primary": "#3b82f6",
              "secondary": "#64748b",
              "accent": "#06b6d4",
              "background": "#ffffff",
              "foreground": "#0f172a",
              "muted": "#f8fafc",
              "border": "#e2e8f0"
            },
            "dark": {
              "primary": "#60a5fa",
              "secondary": "#94a3b8",
              "accent": "#22d3ee",
              "background": "#0f172a",
              "foreground": "#f8fafc",
              "muted": "#1e293b",
              "border": "#334155"
            }
          },
          "styles": {
            "borderRadius": "0.5rem",
            "fontWeight": "500",
            "spacing": "comfortable"
          },
          "components": {
            "light": {
              "button": {
                "primary": "bg-blue-600 hover:bg-blue-700 text-white border-0",
                "secondary": "bg-slate-100 hover:bg-slate-200 text-slate-900 border-0",
                "outline": "border-blue-300 text-blue-700 hover:bg-blue-50 bg-transparent",
                "ghost": "text-blue-600 hover:text-blue-700 hover:bg-blue-50"
              },
              "card": {
                "base": "border-slate-200 bg-white shadow-sm hover:shadow-md transition-shadow",
                "header": "border-b border-slate-100",
                "content": "text-slate-600"
              },
              "form": {
                "input": "border-slate-300 focus:border-blue-500 focus:ring-blue-500 bg-white text-slate-900",
                "label": "text-slate-700 font-medium",
                "focus": "ring-blue-500"
              },
              "alert": {
                "base": "border-blue-200 bg-blue-50",
                "text": "text-blue-800"
              },
              "badge": {
                "base": "bg-blue-100 text-blue-800 border-blue-200",
                "text": "text-blue-800"
              }
            },
            "dark": {
              "button": {
                "primary": "bg-blue-500 hover:bg-blue-400 text-white border-0",
                "secondary": "bg-slate-800 hover:bg-slate-700 text-slate-100 border-0",
                "outline": "border-blue-400 text-blue-400 hover:bg-blue-950 bg-transparent",
                "ghost": "text-blue-400 hover:text-blue-300 hover:bg-blue-950"
              },
              "card": {
                "base": "border-slate-700 bg-slate-900 shadow-lg hover:shadow-xl transition-shadow",
                "header": "border-b border-slate-700",
                "content": "text-slate-300"
              },
              "form": {
                "input": "border-slate-600 bg-slate-800 text-slate-100 focus:border-blue-400 focus:ring-blue-400",
                "label": "text-slate-300 font-medium",
                "focus": "ring-blue-400"
              },
              "alert": {
                "base": "border-blue-500 bg-blue-950",
                "text": "text-blue-200"
              },
              "badge": {
                "base": "bg-blue-900 text-blue-200 border-blue-500",
                "text": "text-blue-200"
              }
            }
          }
        }
      },
      "validation": {
        "valid": true,
        "checkedAt": "2026-06-11T11:33:02.680Z",
        "issues": [],
        "checks": [
          {
            "name": "payload-kind",
            "passed": true
          },
          {
            "name": "theme",
            "passed": true
          }
        ]
      }
    }
  ],
  "createdAt": "2026-06-11T11:33:02.670Z",
  "updatedAt": "2026-06-11T11:33:02.681Z",
  "idempotencyKey": "seed:ocean"
}
