{
  "id": "req-9baf72fbd530",
  "type": "new_component",
  "status": "pending_review",
  "title": "Add CollapsibleCard",
  "currentVersionId": "v1",
  "versions": [
    {
      "id": "v1",
      "createdAt": "2026-06-11T12:16:59.174Z",
      "authorAgent": "my-cv-agent",
      "rationale": "my-cv uses a collapsible, animated card for nested sections; controllable open state makes it broadly reusable.",
      "payload": {
        "kind": "component",
        "meta": {
          "id": "collapsible-card",
          "name": "CollapsibleCard",
          "category": "layout",
          "description": "A card with an animated expand/collapse body and controllable open state.",
          "tags": [
            "card",
            "layout",
            "disclosure"
          ],
          "version": "1.0.0",
          "author": "my-cv-agent",
          "code": "\"use client\";\nimport React, { useState } from \"react\";\nimport { motion, AnimatePresence } from \"framer-motion\";\nimport { ChevronDown } from \"lucide-react\";\n\nexport interface CollapsibleCardProps {\n  title: string;\n  defaultOpen?: boolean;\n  scrollable?: boolean;\n  children: React.ReactNode;\n  className?: string;\n  open?: boolean;\n  onToggle?: (nextOpen: boolean) => void;\n}\n\nexport default function CollapsibleCard({\n  title,\n  defaultOpen = true,\n  scrollable = false,\n  children,\n  className = \"\",\n  open,\n  onToggle,\n}: CollapsibleCardProps) {\n  const [internalOpen, setInternalOpen] = useState(defaultOpen);\n  const isControlled = open !== undefined;\n  const isOpen = isControlled ? open : internalOpen;\n  const handleToggle = () => {\n    if (isControlled) onToggle?.(!isOpen);\n    else setInternalOpen(!isOpen);\n  };\n\n  return (\n    <div\n      className={`border border-neutral-200 dark:border-neutral-800 rounded-xl bg-neutral-50 dark:bg-neutral-800/50 overflow-hidden flex flex-col ${className}`}\n      data-testid=\"rendered-component-collapsiblecard\"\n    >\n      <button\n        onClick={handleToggle}\n        className=\"w-full flex items-center justify-between p-4 hover:bg-neutral-100 dark:hover:bg-neutral-700/50 transition-colors shrink-0\"\n        aria-expanded={isOpen}\n      >\n        <h4 className=\"font-semibold text-neutral-800 dark:text-neutral-100 text-left\">{title}</h4>\n        <motion.div animate={{ rotate: isOpen ? 180 : 0 }} transition={{ duration: 0.2 }}>\n          <ChevronDown className=\"size-5 text-neutral-600 dark:text-neutral-400 shrink-0\" />\n        </motion.div>\n      </button>\n      <AnimatePresence initial={false}>\n        {isOpen && (\n          <motion.div\n            initial={{ height: 0, opacity: 0 }}\n            animate={{ height: \"auto\", opacity: 1 }}\n            exit={{ height: 0, opacity: 0 }}\n            transition={{ duration: 0.2, ease: \"easeInOut\" }}\n            className={`overflow-hidden flex-1 ${scrollable ? \"flex flex-col\" : \"\"}`}\n          >\n            <div className={`p-4 pt-0 ${scrollable ? \"max-h-[400px] overflow-y-auto\" : \"\"}`}>\n              {children}\n            </div>\n          </motion.div>\n        )}\n      </AnimatePresence>\n    </div>\n  );\n}\n",
          "dependencies": [
            "framer-motion",
            "lucide-react"
          ],
          "props": [
            {
              "name": "title",
              "type": "string",
              "required": true,
              "description": "Header label."
            },
            {
              "name": "children",
              "type": [
                "component",
                "function"
              ],
              "required": true,
              "description": "Collapsible content."
            },
            {
              "name": "defaultOpen",
              "type": "boolean",
              "required": false,
              "defaultValue": true,
              "description": "Initial open state (uncontrolled)."
            },
            {
              "name": "open",
              "type": "boolean",
              "required": false,
              "description": "Controlled open state."
            },
            {
              "name": "scrollable",
              "type": "boolean",
              "required": false,
              "defaultValue": false,
              "description": "Constrain body height and scroll."
            },
            {
              "name": "className",
              "type": "string",
              "required": false,
              "description": "Extra CSS classes."
            }
          ]
        },
        "files": [
          {
            "path": "components/display-components/cards/CollapsibleCard/CollapsibleCard.tsx",
            "contents": "\"use client\";\nimport React, { useState } from \"react\";\nimport { motion, AnimatePresence } from \"framer-motion\";\nimport { ChevronDown } from \"lucide-react\";\n\nexport interface CollapsibleCardProps {\n  title: string;\n  defaultOpen?: boolean;\n  scrollable?: boolean;\n  children: React.ReactNode;\n  className?: string;\n  open?: boolean;\n  onToggle?: (nextOpen: boolean) => void;\n}\n\nexport default function CollapsibleCard({\n  title,\n  defaultOpen = true,\n  scrollable = false,\n  children,\n  className = \"\",\n  open,\n  onToggle,\n}: CollapsibleCardProps) {\n  const [internalOpen, setInternalOpen] = useState(defaultOpen);\n  const isControlled = open !== undefined;\n  const isOpen = isControlled ? open : internalOpen;\n  const handleToggle = () => {\n    if (isControlled) onToggle?.(!isOpen);\n    else setInternalOpen(!isOpen);\n  };\n\n  return (\n    <div\n      className={`border border-neutral-200 dark:border-neutral-800 rounded-xl bg-neutral-50 dark:bg-neutral-800/50 overflow-hidden flex flex-col ${className}`}\n      data-testid=\"rendered-component-collapsiblecard\"\n    >\n      <button\n        onClick={handleToggle}\n        className=\"w-full flex items-center justify-between p-4 hover:bg-neutral-100 dark:hover:bg-neutral-700/50 transition-colors shrink-0\"\n        aria-expanded={isOpen}\n      >\n        <h4 className=\"font-semibold text-neutral-800 dark:text-neutral-100 text-left\">{title}</h4>\n        <motion.div animate={{ rotate: isOpen ? 180 : 0 }} transition={{ duration: 0.2 }}>\n          <ChevronDown className=\"size-5 text-neutral-600 dark:text-neutral-400 shrink-0\" />\n        </motion.div>\n      </button>\n      <AnimatePresence initial={false}>\n        {isOpen && (\n          <motion.div\n            initial={{ height: 0, opacity: 0 }}\n            animate={{ height: \"auto\", opacity: 1 }}\n            exit={{ height: 0, opacity: 0 }}\n            transition={{ duration: 0.2, ease: \"easeInOut\" }}\n            className={`overflow-hidden flex-1 ${scrollable ? \"flex flex-col\" : \"\"}`}\n          >\n            <div className={`p-4 pt-0 ${scrollable ? \"max-h-[400px] overflow-y-auto\" : \"\"}`}>\n              {children}\n            </div>\n          </motion.div>\n        )}\n      </AnimatePresence>\n    </div>\n  );\n}\n"
          },
          {
            "path": "components/display-components/cards/CollapsibleCard/CollapsibleCard.meta.json",
            "contents": "{}"
          }
        ]
      },
      "validation": {
        "valid": true,
        "checkedAt": "2026-06-11T12:16:59.183Z",
        "issues": [],
        "checks": [
          {
            "name": "payload-kind",
            "passed": true
          },
          {
            "name": "component-meta",
            "passed": true
          },
          {
            "name": "proposed-files",
            "passed": true
          },
          {
            "name": "file-syntax",
            "passed": true
          }
        ]
      }
    }
  ],
  "createdAt": "2026-06-11T12:16:59.174Z",
  "updatedAt": "2026-06-11T12:16:59.183Z",
  "idempotencyKey": "mycv:collapsible-card"
}
