{
  "id": "req-a0f8664a1327",
  "type": "new_theme",
  "status": "pending_review",
  "title": "Add Portfolio theme",
  "currentVersionId": "v1",
  "versions": [
    {
      "id": "v1",
      "createdAt": "2026-06-11T12:16:59.199Z",
      "authorAgent": "my-cv-agent",
      "rationale": "Capture the my-cv blue->purple gradient look as a reusable theme.",
      "payload": {
        "kind": "theme",
        "theme": {
          "id": "portfolio",
          "name": "Portfolio",
          "description": "Blue-to-purple gradients over slate neutrals, from the My CV site.",
          "colors": {
            "light": {
              "primary": "#2563eb",
              "secondary": "#7c3aed",
              "accent": "#9333ea",
              "background": "#ffffff",
              "foreground": "#0f172a",
              "muted": "#f8fafc",
              "border": "#e2e8f0"
            },
            "dark": {
              "primary": "#60a5fa",
              "secondary": "#a78bfa",
              "accent": "#c084fc",
              "background": "#0f172a",
              "foreground": "#f8fafc",
              "muted": "#1e293b",
              "border": "#334155"
            }
          },
          "styles": {
            "borderRadius": "0.75rem",
            "fontWeight": "600",
            "spacing": "comfortable"
          },
          "components": {
            "light": {
              "button": {
                "primary": "bg-gradient-to-r from-blue-600 to-purple-600 hover:from-blue-700 hover:to-purple-700 text-white border-0",
                "secondary": "bg-slate-100 hover:bg-slate-200 text-slate-900 border-0",
                "outline": "border-blue-300 text-blue-700 hover:bg-blue-50 bg-transparent",
                "ghost": "text-blue-600 hover:text-blue-700 hover:bg-blue-50"
              },
              "card": {
                "base": "border-slate-200 bg-white shadow-sm",
                "header": "border-b border-slate-100",
                "content": "text-slate-600"
              },
              "form": {
                "input": "border-slate-300 focus:border-blue-500 focus:ring-blue-500 bg-white text-slate-900",
                "label": "text-slate-700 font-medium",
                "focus": "ring-blue-500"
              },
              "alert": {
                "base": "border-blue-200 bg-blue-50",
                "text": "text-blue-800"
              },
              "badge": {
                "base": "bg-gradient-to-r from-blue-100 to-purple-100 text-blue-800 border-blue-200",
                "text": "text-blue-800"
              }
            },
            "dark": {
              "button": {
                "primary": "bg-gradient-to-r from-blue-500 to-purple-500 hover:from-blue-400 hover:to-purple-400 text-white border-0",
                "secondary": "bg-slate-800 hover:bg-slate-700 text-slate-100 border-0",
                "outline": "border-blue-400 text-blue-300 hover:bg-blue-950 bg-transparent",
                "ghost": "text-blue-300 hover:text-blue-200 hover:bg-blue-950"
              },
              "card": {
                "base": "border-slate-700 bg-slate-900 shadow-lg",
                "header": "border-b border-slate-700",
                "content": "text-slate-300"
              },
              "form": {
                "input": "border-slate-600 bg-slate-800 text-slate-100 focus:border-blue-400 focus:ring-blue-400",
                "label": "text-slate-300 font-medium",
                "focus": "ring-blue-400"
              },
              "alert": {
                "base": "border-blue-500 bg-blue-950",
                "text": "text-blue-200"
              },
              "badge": {
                "base": "bg-gradient-to-r from-blue-900 to-purple-900 text-blue-200 border-blue-500",
                "text": "text-blue-200"
              }
            }
          }
        }
      },
      "validation": {
        "valid": true,
        "checkedAt": "2026-06-11T12:16:59.203Z",
        "issues": [],
        "checks": [
          {
            "name": "payload-kind",
            "passed": true
          },
          {
            "name": "theme",
            "passed": true
          }
        ]
      }
    }
  ],
  "createdAt": "2026-06-11T12:16:59.199Z",
  "updatedAt": "2026-06-11T12:16:59.203Z",
  "idempotencyKey": "mycv:portfolio-theme"
}
